{"actions":[{"action_id":"act:c1469cd23d6b2eba99df110ae94ffe303a513da6c7bd8d0a8e91962de5b167d1","expected_effect":{"clears_reasons":["RULE_WORLD_UNKNOWNS_SECURITY"],"may_change_hashes":true},"goal":"Fill missing world context required for verification.","inputs":{"enrichment_path":"docs/demo/world_enrich.json","missing":[{"event_id":"event:3333333333333333333333333333333333333333333333333333333333333333","kind":"missing_actor","value":null},{"event_id":"event:3333333333333333333333333333333333333333333333333333333333333333","kind":"missing_time","value":null}]},"kind":"ADD_WORLD_ENRICHMENT","priority":10,"receipts":{"entity_ids":[],"event_ids":["event:3333333333333333333333333333333333333333333333333333333333333333"],"evidence_refs":[{"chunk_id":"chunk:1","offset_end":39,"offset_start":0,"source_id":"doc:1","text_sha256":"c8b129c037c222f8e55a6d791b6d36cec99161945ac3be7b7de2745be2174f03"},{"chunk_id":"chunk:2","offset_end":79,"offset_start":40,"source_id":"doc:1","text_sha256":"e9db98377dd9ebaa2acd26b224f0f47052dc4bc5a19c8ae34d9f768055bd1284"},{"chunk_id":"chunk:3","offset_end":119,"offset_start":80,"source_id":"doc:1","text_sha256":"350e951b0fba25ee9097f5eeeac0184ae84326a0df509f8fd8ccf037ad4f68b3"}],"trigger_reasons":["RULE_WORLD_UNKNOWNS_SECURITY"]},"risk":"low"}],"base":{"attestation_sha256":"","output_sha256":"0000000000000000000000000000000000000000000000000000000000000000","world_sha256":"dca859a4c8c4adec5e8b1c9b9f32f311958a3b50d2f0a977c1e3e361bbce7a1f"},"notes":"Deterministic repair planning; no autonomous external actions.","plan_id":"plan:48a1c56a6d5d90d340f53caed309cf95a66d0432fc698443eeeac7ccf17cb0a6","ruleset_id":"ruleset.core.v1","status":"VERIFIED_NEEDS_INFO","version":"1.0"}